{
  "contractVersion": 1,
  "tenantId": "d49e8bda-bf5d-4ef6-a707-aaed67d19847",
  "sourceType": "GESTUDIO_STUDENT",
  "checkpoint": "gestudio-students-2026-07-20T14:00:00Z",
  "nextCursor": null,
  "fullSnapshot": true,
  "records": [
    {
      "sourceId": "42",
      "displayName": "Ada Ejemplo",
      "active": true
    },
    {
      "sourceId": "57",
      "displayName": "Grace Ejemplo",
      "active": false
    }
  ]
}
